{
  "$schema": "https://json-schema.org/draft/2020-12/schema",
  "type": "object",
  "properties": {
    "allowed-tools": {
      "type": "string",
      "description": "Пробельно-разделённый список разрешённых инструментов (например, 'Bash(git:*) Read')."
    },
    "compatibility": {
      "type": "string",
      "description": "Требования к окружению (до 500 символов)."
    },
    "constraints": {
      "type": "object",
      "properties": {
        "allowedOperations": {
          "description": "Список разрешённых операций, которые могут выполняться в шагах.",
          "type": "array",
          "items": {
            "type": "string"
          }
        },
        "maxInputLength": {
          "type": "integer",
          "description": "Максимальная длина входных данных (число символов)."
        },
        "timeoutSeconds": {
          "type": "integer",
          "description": "Максимальное время выполнения скилла в секундах."
        }
      },
      "description": "Ограничения на выполнение скилла."
    },
    "description": {
      "type": "string",
      "description": "Краткое описание функциональности скилла и случаев использования (1-1024 символа)."
    },
    "disable-model-invocation": {
      "type": "boolean",
      "description": "Скрыть скилл от модели (по умолчанию false)."
    },
    "license": {
      "type": "string",
      "description": "Название лицензии или ссылка на неё."
    },
    "metadata": {
      "type": "object",
      "description": "Произвольные метаданные в виде пар ключ-значение."
    },
    "name": {
      "type": "string",
      "description": "Уникальное имя скилла (kebab-case, 1-64 символа)."
    },
    "paths": {
      "description": "Список глоб-паттернов для активации скилла по файлам.",
      "type": "array",
      "items": {
        "type": "string"
      }
    },
    "priority": {
      "type": "integer",
      "description": "Приоритет скилла (число, выше → раньше в списке)."
    },
    "resources": {
      "type": "object",
      "properties": {
        "assets": {
          "description": "Список путей к статическим файлам (ассетам).",
          "type": "array",
          "items": {
            "type": "string"
          }
        },
        "examples": {
          "description": "Список примеров ввода/вывода для демонстрации работы скилла.",
          "type": "array",
          "items": {
            "type": "object",
            "properties": {
              "input": {
                "type": "string",
                "description": "Входные данные для примера."
              },
              "output": {
                "type": "string",
                "description": "Ожидаемый выходной результат для примера."
              }
            }
          }
        },
        "references": {
          "description": "Список путей к файлам документации или ссылкам.",
          "type": "array",
          "items": {
            "type": "string"
          }
        },
        "scripts": {
          "description": "Список путей к исполняемым скриптам, используемым скиллом.",
          "type": "array",
          "items": {
            "type": "string"
          }
        }
      },
      "description": "Внешние ресурсы, используемые скиллом (примеры, документация, скрипты, ассеты)."
    },
    "responseTemplate": {
      "type": "object",
      "properties": {
        "content": {
          "type": "string",
          "description": "Шаблон содержимого ответа с плейсхолдерами в двойных фигурных скобках ({{...}})."
        },
        "format": {
          "type": "string",
          "description": "Формат ответа, например 'text' или 'json'."
        }
      },
      "description": "Шаблон форматирования ответа."
    },
    "steps": {
      "description": "Последовательность шагов выполнения скилла.",
      "type": "array",
      "items": {
        "type": "object",
        "properties": {
          "description": {
            "type": "string",
            "description": "Пояснение к шагу (опционально)."
          },
          "id": {
            "type": "string",
            "description": "Уникальный идентификатор шага в рамках скилла."
          },
          "input": {
            "type": "string",
            "description": "Шаблон входных данных для шага с плейсхолдерами ({{...}})."
          },
          "operation": {
            "type": "string",
            "description": "Конкретная операция, выполняемая шагом (например, 'split', 'length')."
          },
          "output": {
            "type": "string",
            "description": "Имя переменной, в которую сохраняется результат шага."
          },
          "type": {
            "type": "string",
            "description": "Тип шага (например, 'calculation', 'text_processing', 'api_call', 'conditional')."
          }
        }
      }
    },
    "targetAgents": {
      "description": "Список CLI-агентов, для которых предназначен скилл (минимум 'qwen').",
      "type": "array",
      "items": {
        "type": "string"
      }
    },
    "user-invocable": {
      "type": "boolean",
      "description": "Доступность скилла через /<skill-name> (по умолчанию true)."
    }
  }
}