{
  "name": "checkstyle-simple-checks",
  "description": "Запускает Checkstyle с пользовательскими простыми проверками (на основе регулярных выражений, без Java-кода) для исходных файлов Java с использованием предоставленного bash-скрипта. Используйте, когда необходимо обеспечить соблюдение стандартов кодирования, таких как запрет звёздных импортов, System.out.println, printStackTrace и требование Javadoc для публичных методов.",
  "compatibility": "Требуется Java 11+ и checkstyle-10.18.1-all.jar, расположенный в каталоге lib/. Необходима оболочка Bash.",
  "license": "MIT",
  "metadata": {
    "author": "user",
    "version": "1.0",
    "tags": "checkstyle, java, линтинг, качество кода"
  },
  "allowed-tools": "Bash(run-checkstyle-simple-custom.sh:*) Read",
  "targetAgents": ["qwen"],
  "user-invocable": true,
  "disable-model-invocation": false,
  "paths": ["src/**/*.java"],
  "priority": 10,
  "constraints": {
    "timeoutSeconds": 120
  },
  "steps": [
    {
      "id": "verify-dependencies",
      "type": "bash",
      "operation": "check",
      "input": "{{checkstyle_jar}} {{config_file}}",
      "output": "dependencies_ok",
      "description": "Проверяет наличие JAR-файла Checkstyle и пользовательского XML-конфига."
    },
    {
      "id": "run-checkstyle",
      "type": "bash",
      "operation": "execute",
      "input": "{{source_path}}",
      "output": "report",
      "description": "Запускает Checkstyle с конфигурацией простых пользовательских проверок для целевых исходных файлов Java."
    }
  ],
  "resources": {
    "scripts": ["scripts/run-checkstyle-simple-custom.sh"],
    "assets": ["config/my_simple_checks.xml"],
    "examples": [
      {
        "input": "Запустить checkstyle для src/main/java с пользовательскими простыми правилами",
        "output": "Checkstyle завершён: 0 нарушений найдено."
      }
    ]
  },
  "responseTemplate": {
    "content": "Отчёт Checkstyle:\n{{report}}",
    "format": "text"
  }
}