{
  "name": "generate-java-selenide-test",
  "description": "Преобразует описание UI тест-кейса на русском языке в автоматизированный Java-тест с Selenide. Использует Frap для анализа DOM и генерации Page Object, chrome-devtools-mcp для управления браузером. Создаёт два файла: PageObject и тестовый класс. Временные артефакты сохраняются в .frap/ и .frap-work/ в корне проекта. Используйте, когда нужно создать UI-тест по шагам, описанным на естественном языке.",
  "compatibility": "Требуется Java проект с Maven или Gradle, зависимость Selenide, доступ к MCP-серверам Frap и chrome-devtools-mcp. Создаёт временные файлы в директориях .frap/ и .frap-work/.",
  "license": "MIT",
  "metadata": {
    "author": "user",
    "version": "1.1",
    "category": "test-automation",
    "tags": "java, selenide, ui-testing, frap, chrome-devtools, page-object"
  },
  "allowed-tools": "Bash(cat:*, grep:*, find:*, echo:*, cp:*, mv:*) Write",
  "targetAgents": [
    "qwen"
  ],
  "user-invocable": true,
  "disable-model-invocation": false,
  "paths": [
    "src/test/java/**/*.java"
  ],
  "priority": 10,
  "constraints": {
    "allowedOperations": [
      "frap_snapshot_script",
      "frap_build_element_map",
      "frap_generate_page_object",
      "frap_help",
      "evaluate_script",
      "list_pages",
      "close_page",
      "new_page",
      "navigate_page",
      "read_file",
      "write_file",
      "move_file",
      "copy_file",
      "grep"
    ],
    "maxInputLength": 5000,
    "timeoutSeconds": 180
  },
  "steps": [
    {
      "id": "check-selenide-dependency",
      "type": "text_processing",
      "operation": "check_dependency",
      "input": "{{project_dir}}/pom.xml или build.gradle",
      "output": "selenide_exists",
      "description": "Проверяет наличие зависимости Selenide в файле сборки проекта. Если отсутствует — ошибка и остановка."
    },
    {
      "id": "check-mcp-servers",
      "type": "api_call",
      "operation": "check_availability",
      "input": "вызовы frap_help и list_pages",
      "output": "servers_available",
      "description": "Проверяет доступность MCP-серверов: вызывает frap_help (Frap) и list_pages (chrome-devtools-mcp). При недоступности любого — ошибка и остановка."
    },
    {
      "id": "extract-test-info",
      "type": "text_processing",
      "operation": "extract",
      "input": "описание тест-кейса от пользователя",
      "output": "{className, pageUrl, packageName, steps_text}",
      "description": "Извлекает имя тестового класса (например, 'LoginTest'), URL страницы, имя пакета и шаги из описания на русском языке."
    },
    {
      "id": "open-page",
      "type": "api_call",
      "operation": "open_and_navigate",
      "input": "{{pageUrl}}",
      "output": "page_ready",
      "description": "Открывает новую страницу в браузере через chrome-devtools-mcp и переходит по целевому URL."
    },
    {
      "id": "get-snapshot-script",
      "type": "api_call",
      "operation": "frap_snapshot_script",
      "input": "",
      "output": "snapshot_script",
      "description": "Получает JavaScript-код для захвата DOM-снимка от Frap (инструмент frap_snapshot_script)."
    },
    {
      "id": "prepare-sync-script",
      "type": "text_processing",
      "operation": "wrap_iife",
      "input": "{{snapshot_script}}",
      "output": "sync_script",
      "description": "Если скрипт содержит async/await, оборачивает его в синхронную самовызывающуюся функцию (IIFE) без async/await, чтобы обеспечить синхронное выполнение в chrome-devtools-mcp."
    },
    {
      "id": "execute-script",
      "type": "api_call",
      "operation": "evaluate_script",
      "input": "{{sync_script}}",
      "output": "dom_snapshot",
      "description": "Выполняет синхронный скрипт в браузере через chrome-devtools-mcp (evaluate_script) и получает DOM-снимок страницы."
    },
    {
      "id": "save-snapshot",
      "type": "file_operation",
      "operation": "write_file",
      "input": "{{dom_snapshot}} в файл .frap/snapshot.json",
      "output": "snapshot_path",
      "description": "Сохраняет полученный DOM-снимок во временную папку .frap/ в корне проекта для использования в режиме file."
    },
    {
      "id": "build-element-map",
      "type": "api_call",
      "operation": "frap_build_element_map",
      "input": "{domSnapshotPath: {{snapshot_path}}}",
      "output": "element_map_path",
      "description": "Строит карту элементов (ElementMap) из DOM-снимка с помощью Frap."
    },
    {
      "id": "generate-page-object",
      "type": "api_call",
      "operation": "frap_generate_page_object",
      "input": "{elementMapPath: {{element_map_path}}, language: 'java_selenide', className: {{pageClassName}}, packageName: {{packageName}}}",
      "output": "page_object_files",
      "description": "Генерирует код Page Object на Java с аннотациями Selenide (language=java_selenide). Возвращает список путей к файлам (режим file)."
    },
    {
      "id": "save-page-object-temp",
      "type": "file_operation",
      "operation": "copy_file",
      "input": "{{page_object_files}} -> .frap-work/pages/",
      "output": "temp_page_object_paths",
      "description": "Копирует сгенерированные Page Object файлы во временную папку .frap-work/pages/ для отладки и последующего использования."
    },
    {
      "id": "copy-page-objects-to-project",
      "type": "file_operation",
      "operation": "copy_file",
      "input": "{{temp_page_object_paths}} -> src/main/java/.../pages/",
      "output": "project_page_object_paths",
      "description": "Копирует Page Object файлы в стандартную директорию pages основного проекта (src/main/java/...)."
    },
    {
      "id": "generate-test-class",
      "type": "text_processing",
      "operation": "template",
      "input": "{{temp_page_object_paths}} и {{steps_text}}",
      "output": "test_class_code",
      "description": "Генерирует код тестового класса на основе временных Page Object и описания шагов. Использует русские комментарии, аннотации TestNG/JUnit и методы Selenide."
    },
    {
      "id": "write-test-file",
      "type": "file_operation",
      "operation": "write_file",
      "input": "{{test_class_code}} в src/test/java/.../{{className}}Test.java",
      "output": "test_file_path",
      "description": "Сохраняет сгенерированный тестовый класс в стандартную директорию тестов проекта."
    },
    {
      "id": "close-browser",
      "type": "api_call",
      "operation": "close_page",
      "input": "",
      "output": "browser_closed",
      "description": "Закрывает браузер через chrome-devtools-mcp, освобождая ресурсы."
    }
  ],
  "resources": {
    "examples": [
      {
        "input": "Тест-кейс: авторизация пользователя. Открыть https://example.com/login, ввести логин 'admin', пароль '123', нажать кнопку 'Войти'. Проверить, что отображается приветствие 'Добро пожаловать'.",
        "output": "Создан файл src/test/java/com/example/tests/LoginTest.java с методом testAuthorization(). Page Object LoginPage.java сохранён в .frap-work/pages/ и src/main/java/com/example/pages/."
      },
      {
        "input": "Тест-кейс: поиск товара. Перейти на https://shop.com, ввести в поиск 'ноутбук', нажать Enter. Проверить, что в результатах есть хотя бы один товар.",
        "output": "Создан файл src/test/java/com/example/tests/SearchTest.java с методом testProductSearch(). Page Object MainPage.java сохранён в .frap-work/pages/ и src/main/java/com/example/pages/."
      }
    ],
    "references": [
      "https://github.com/kotler-dev/frap",
      "https://github.com/kotler-dev/frap/blob/develop/java-v1.1.1/README.md"
    ]
  },
  "responseTemplate": {
    "content": "✅ Тестовый класс {{testClassName}} успешно создан: {{testFilePath}}. Page Object сохранён во временной папке .frap-work/pages/ и в проекте в {{projectPageObjectPaths}}.",
    "format": "text"
  }
}