{
  "name": "text-to-java-ui-test",
  "description": "Преобразует описание тест-кейса на естественном языке в автоматизированный Java UI-тест с использованием MCP-Frap и chrome-devtools-mcp. Генерирует файл теста в папке тестов проекта. Используйте, когда необходимо создать исполняемый Java-тест из сценария тест-кейса, используя взаимодействие с браузером через Chrome DevTools Protocol.",
  "compatibility": "Требуется запущенный MCP-Frap сервер (stdio/http), chrome-devtools-mcp, Java 11+, Maven/Gradle и доступ в интернет для веб-тестирования. Скилл автоматически проверяет наличие зависимости Selenium в проекте (через pom.xml или build.gradle) и доступность обоих MCP-серверов перед генерацией теста.",
  "license": "MIT",
  "metadata": {
    "author": "user",
    "version": "1.0",
    "category": "тестовая автоматизация",
    "tags": "java, selenium, mcp-frap, chrome-devtools-mcp, генерация-тестов"
  },
  "targetAgents": [
    "qwen"
  ],
  "user-invocable": true,
  "constraints": {
    "maxInputLength": 5000,
    "timeoutSeconds": 300
  },
  "steps": [
    {
      "id": "validate-selenium-dependency",
      "type": "conditional",
      "operation": "check_dependency",
      "input": "project_build_file",
      "output": "dependency_ok",
      "description": "Проверяет, что в проекте подключена зависимость Selenium WebDriver (анализирует pom.xml или build.gradle). Если зависимость отсутствует, генерирует сообщение об ошибке и останавливает выполнение."
    },
    {
      "id": "check-mcp-servers",
      "type": "api_call",
      "operation": "verify_mcp_connections",
      "input": "",
      "output": "mcp_ok",
      "description": "Проверяет доступность MCP-серверов chrome-devtools-mcp и Frap, выполняя простые вызовы инструментов (например, frap_help и list_pages). Если хотя бы один сервер не отвечает, прерывает выполнение с сообщением об ошибке."
    },
    {
      "id": "parse-test-case",
      "type": "text_processing",
      "operation": "extract",
      "input": "{{user_input}}",
      "output": "parsed_test_case",
      "description": "Анализирует описание тест-кейса на естественном языке, извлекая шаги, ожидаемые результаты и задействованные элементы страницы. Также извлекает предлагаемое имя класса теста (например, из названия тест-кейса)."
    },
    {
      "id": "fetch-snapshot-script",
      "type": "api_call",
      "operation": "frap_snapshot_script",
      "input": "",
      "output": "frap_script",
      "description": "Получает от MCP-Frap JavaScript-код для захвата DOM-снимка. ВАЖНО: код возвращается в асинхронном виде (с async/await), поэтому его необходимо обернуть в синхронную самовызывающуюся функцию (IIFE) без async/await, чтобы chrome-devtools-mcp смог выполнить его через evaluate_script."
    },
    {
      "id": "wrap-script-sync",
      "type": "text_processing",
      "operation": "transform",
      "input": "{{frap_script}}",
      "output": "sync_snapshot_script",
      "description": "Преобразует асинхронный скрипт в синхронный вид, удаляя async/await и оборачивая в IIFE, возвращающую готовый объект DOM-снимка. Это необходимо, потому что chrome-devtools-mcp поддерживает только синхронное выполнение."
    },
    {
      "id": "capture-dom-snapshot",
      "type": "api_call",
      "operation": "evaluate_script",
      "input": "{{sync_snapshot_script}}",
      "output": "dom_snapshot",
      "description": "Выполняет подготовленный синхронный скрипт через chrome-devtools-mcp (инструмент evaluate_script) для захвата DOM-снимка текущей страницы."
    },
    {
      "id": "build-element-map",
      "type": "api_call",
      "operation": "frap_build_element_map",
      "input": "{{dom_snapshot}}",
      "output": "element_map",
      "description": "Строит карту элементов (element map) из DOM-снимка с помощью Frap."
    },
    {
      "id": "generate-page-object",
      "type": "api_call",
      "operation": "frap_generate_page_object",
      "input": "element_map={{element_map}} language=java_selenium class_name=GeneratedPage package_name=com.example.tests",
      "output": "page_object_code",
      "description": "Генерирует Java-класс Page Object, используя генератор Frap (нацеленный на Selenium WebDriver)."
    },
    {
      "id": "assemble-test-code",
      "type": "text_processing",
      "operation": "template",
      "input": "test_case={{parsed_test_case}} page_object={{page_object_code}}",
      "output": "final_java_test",
      "description": "Объединяет проанализированный тест-кейс с сгенерированным Page Object для получения полного Java-тестового метода на JUnit."
    },
    {
      "id": "write-test-file",
      "type": "text_processing",
      "operation": "write",
      "input": "file_path=src/test/java/com/example/tests/{{test_class_name}}.java content={{final_java_test}}",
      "output": "file_written",
      "description": "Записывает сгенерированный код теста в файл внутри стандартной директории тестов проекта. Использует извлечённое имя класса для формирования имени файла."
    },
    {
      "id": "close-browser",
      "type": "api_call",
      "operation": "close_page",
      "input": "",
      "output": "",
      "description": "Закрывает текущую страницу или браузер через chrome-devtools-mcp (инструмент close_page), чтобы освободить ресурсы после завершения генерации теста."
    }
  ],
  "resources": {
    "examples": [
      {
        "input": "Тест-кейс: Вход с валидными учетными данными. Шаги: 1. Перейти на страницу входа. 2. Ввести имя пользователя 'admin'. 3. Ввести пароль 'secret'. 4. Нажать кнопку входа. Ожидаемый результат: Отображается страница дашборда.",
        "output": "Файл src/test/java/com/example/tests/LoginTest.java с готовым Selenium-тестом."
      }
    ],
    "references": [
      "https://github.com/kotler-dev/frap/blob/develop/README.md"
    ]
  },
  "responseTemplate": {
    "content": "// Сгенерированный Java UI тест (сохранён в {{file_path}})\n{{final_java_test}}",
    "format": "text"
  },
  "allowed-tools": "Bash(java:*) Bash(mvn:*) Bash(gradle:*) Bash(grep:*) Read Write",
  "priority": 10
}